Job Title,Location,Link,Job Responsibilities,Profile,Additional Information
IT Business Analyst (m/f/d)RimowaReference: RIM01097,IT Business Analyst (m/f/d),https://www.lvmh.com/join-us/our-job-offers/RIM01097,"Job responsibilities
Work collaboratively with the IT team and other business units to determine the scope, elicit the requirements, documentation, and implementation timeline of various IT projects;
Lead/facilitate business requirements workshops to understand the business requirements using a variety of techniques;
Translate business needs into clear functional and technical requirements for the developers to develop;
Create user stories / Tasks out of Business Requirements and support in scoping Sprints;
Work closely with developers during the development, testing, implementation and after go-live of the solution;
Responsible to conduct workload estimation for the projects;
Coordinate deliveries, training plan and all processes required for the releases;
Prepare documentation on expected benefits, use cases, current/proposed process, workflows, data flows alongside with the functional and non-functional specifications;
Document affected processes (current mode of operations vs future mode of operation) and procedures;
Participate in the creation of change management and training strategy.","Profile
at least 3+ years of Experience as a Business Analyst, in the consumer product industry for retail, wholesale or manufacturing businesses;
University Degree or College Diploma, preferably in Computer Science or related discipline;
Certified Business Analysis Professional (CBAP), PMP or Scrum Master certification;
Experience with Business Process Reviews and requirements gathering, including the ability to use various techniques (JAD, interviewing, use case modeling, gap-fit analysis, data flow diagrams, process definition, etc.);
Experience in Jira, Confluence, Teamworks, Knowledge of SQL, prior experience with Desktop or Web applications will be an asset;
Strong interpersonal and team-building skills;
Analytical thinking, strong vision, communication skills and persuasiveness, to resolve issues with cross-functional teams;
Enthusiastic and positive attitude towards difficult tasks;
Fluent English oral and written; French or German are assets.","Additional informationYOUR BENEFITS:

30 days paid vacation per year and overtime compensation
Attractive remuneration (collective agreement) + annual profit sharing
International and interesting environment within the LVHM Group
Individual development and coaching opportunities
Exciting project opportunities
30% discount on the RIMOWA product range
Company benefits (e.g. for sports, lifestyle, fashion, etc.).
Regular private sales at RIMOWA and the LVMH Group (e.g. Tag Heuer, Moet Hennessy)
Company pension plan with high employer contribution or other capital-forming benefits
LVMH Heartfund in crisis situations
Pension commitment in the event of death or disability (employer-financed)
Good transport connections, sufficient employee parking spaces, job tickets & job bikes (partly subsidized)
Regular employee events (summer party, Christmas party, after work events)
Qualitative company restaurant

BECOME PART OF RIMOWA:
Please send us your complete application documents including your salary requirements with details of the next possible starting date.
We look forward to receiving your application! 
Look for us on Instagram and Twitter @RIMOWA or visit us on our RIMOWA Career page: https://career.rimowa.com/
Celebrating our inclusive and diverse culture is core to RIMOWA’s DNA. We know that for our business to thrive, we depend on having diverse talent with a range of backgrounds, skills and capabilities in each of the countries in which we operate and to reflect our broad consumer base. We view diversity as one of the key enablers that helps our business to grow."
